{"$schema":"https://json-schema.org/draft/2020-12/schema","type":"object","additionalProperties":false,"required":["schema","fixture","canonical_findings","sources","close_index","expected_head","checkpoint","allowed_next_inputs","claim_vector","acceptance_test"],"properties":{"schema":{"const":"s0-source-transition-authority/v1"},"fixture":{"$ref":"#/$defs/fixture"},"canonical_findings":{"type":"array","minItems":14,"maxItems":14,"items":{"$ref":"#/$defs/finding"}},"sources":{"type":"array","minItems":4,"maxItems":4,"items":{"$ref":"#/$defs/source"}},"close_index":{"$ref":"#/$defs/ref"},"expected_head":{"$ref":"#/$defs/head"},"checkpoint":{"$ref":"#/$defs/checkpoint"},"allowed_next_inputs":{"type":"array","minItems":1,"items":{"$ref":"#/$defs/input"}},"claim_vector":{"$ref":"#/$defs/claims"},"acceptance_test":{"$ref":"#/$defs/acceptance"}},"$defs":{"digest":{"type":"string","pattern":"^sha256:[0-9a-f]{64}$"},"path":{"type":"string","pattern":"^[A-Za-z0-9][A-Za-z0-9._/-]*$","minLength":1},"ref":{"type":"object","additionalProperties":false,"required":["path","digest"],"properties":{"path":{"$ref":"#/$defs/path"},"digest":{"$ref":"#/$defs/digest"}}},"fixture":{"type":"object","additionalProperties":false,"required":["kind","run_id","synthetic_head"],"properties":{"kind":{"const":"source-only"},"run_id":{"type":"string","minLength":1},"synthetic_head":{"const":true}}},"finding":{"type":"object","additionalProperties":false,"required":["id","state","outcome","attempts"],"properties":{"id":{"type":"string","pattern":"^S0-(W1|C|D|E)-F[0-9]{3}$"},"state":{"const":"required"},"outcome":{"const":"closed"},"attempts":{"type":"array","minItems":1,"maxItems":5,"items":{"type":"integer","minimum":1,"maximum":5}}}},"source":{"type":"object","additionalProperties":false,"required":["path","digest"],"properties":{"path":{"$ref":"#/$defs/path"},"digest":{"$ref":"#/$defs/digest"}}},"head":{"type":"object","additionalProperties":false,"required":["revision","transaction_digest"],"properties":{"revision":{"type":"integer","minimum":1},"transaction_digest":{"$ref":"#/$defs/digest"}}},"checkpoint":{"type":"object","additionalProperties":false,"required":["checkpoint_id","digest"],"properties":{"checkpoint_id":{"type":"string","minLength":1},"digest":{"$ref":"#/$defs/digest"}}},"input":{"type":"object","additionalProperties":false,"required":["identity","digest"],"properties":{"identity":{"type":"string","minLength":1},"digest":{"$ref":"#/$defs/digest"}}},"claims":{"type":"object","additionalProperties":false,"required":["source_transition_fixture_passed","actual_a7","migration","activation","full_ready","named_targets","profile_targets"],"properties":{"source_transition_fixture_passed":{"const":true},"actual_a7":{"const":false},"migration":{"const":false},"activation":{"const":false},"full_ready":{"const":false},"named_targets":{"const":3},"profile_targets":{"const":0}}},"acceptance":{"type":"object","additionalProperties":false,"required":["command","exit_status","tests_run","status"],"properties":{"command":{"const":"PYTHONDONTWRITEBYTECODE=1 PYTHONPATH=agent-workflows/src python3 -m unittest discover -s agent-workflows/tests -p 'test_*.py'"},"exit_status":{"const":0},"tests_run":{"type":"integer","minimum":1},"status":{"const":"passed"}}}}}
