{"acceptance_test":{"command":"PYTHONDONTWRITEBYTECODE=1 PYTHONPATH=agent-workflows/src python3 -m unittest discover -s agent-workflows/tests -p 'test_*.py'","exit_status":0,"status":"passed","tests_run":209},"allowed_next_inputs":[{"digest":"sha256:d93bbb524c8ea56e1d431cb6f9627ae170a2572ca1d3395e6bf33cad59478f97","identity":"next-S0-A"},{"digest":"sha256:96115e6b7c9bff2fdd7e3926664be04b7242df6c24f81eece9ad133c11b033c5","identity":"next-S0-B"},{"digest":"sha256:75f27e6e5180614f5fd4b8e6a285ae937b07ecb1325aba0490b55065372e91ed","identity":"next-S0-C"},{"digest":"sha256:b111d15f50c0c1f6d610864bf45b893deb045553f6f56d620d4b0e69c222cd6a","identity":"next-S0-D"}],"canonical_findings":[{"attempts":[1,2],"id":"S0-W1-F001","outcome":"closed","state":"required"},{"attempts":[1,2],"id":"S0-W1-F002","outcome":"closed","state":"required"},{"attempts":[1],"id":"S0-W1-F003","outcome":"closed","state":"required"},{"attempts":[1,2],"id":"S0-W1-F004","outcome":"closed","state":"required"},{"attempts":[1,2],"id":"S0-W1-F005","outcome":"closed","state":"required"},{"attempts":[1],"id":"S0-W1-F006","outcome":"closed","state":"required"},{"attempts":[1,2],"id":"S0-W1-F007","outcome":"closed","state":"required"},{"attempts":[1,2],"id":"S0-W1-F008","outcome":"closed","state":"required"},{"attempts":[1,2,3],"id":"S0-C-F001","outcome":"closed","state":"required"},{"attempts":[1,2],"id":"S0-D-F001","outcome":"closed","state":"required"},{"attempts":[1],"id":"S0-E-F001","outcome":"closed","state":"required"},{"attempts":[1,2],"id":"S0-E-F002","outcome":"closed","state":"required"},{"attempts":[1,2,3],"id":"S0-E-F003","outcome":"closed","state":"required"},{"attempts":[1],"id":"S0-E-F004","outcome":"closed","state":"required"}],"checkpoint":{"checkpoint_id":"s0-source-closure-cp-2026-09-04","digest":"sha256:6425cf29163434fc0282d15315ba684d97790c77918f4869636a66a76139f8de"},"claim_vector":{"activation":false,"actual_a7":false,"full_ready":false,"migration":false,"named_targets":3,"profile_targets":0,"source_transition_fixture_passed":true},"close_index":{"digest":"sha256:74b10d757ef188ae5d11cbc1ac476038a148702d184e5cef5389ea8a7ab1dde4","path":"agent-workflows/evidence/sections/S0/index.json"},"expected_head":{"revision":1,"transaction_digest":"sha256:3333333333333333333333333333333333333333333333333333333333333333"},"fixture":{"kind":"source-only","run_id":"s0-source-transition-2026-09-04","synthetic_head":true},"schema":"s0-source-transition-authority/v1","sources":[{"digest":"sha256:6c1b2ed01a4151ead414c24bd1d2eab78f596623039f038a3f2c17c212ebb401","path":"docs/plans/ai-agent-workflow-full-implementation-plan.md"},{"digest":"sha256:ff10c21f8e6ef31c25d30226ca8c633d7d0826a92a650129cf959b7f86df35ee","path":"docs/plans/ai-agent-workflow-s0-section-plan.md"},{"digest":"sha256:8418e7d32291860faeb7e905b048a7ff7a03d0768b258ac9e4a75f4e7d498b6b","path":"docs/plans/ai-agent-workflow-step-catalog.md"},{"digest":"sha256:2fd1caaddf4509d2f56bd31a68b062290e70f2f2da33facf1d8187d476bb3f1d","path":"agent-workflows/catalog.yaml"}]}
